{
  "$schema": "schemas/capability-ownership-rules.schema.json",
  "schema_version": 1,
  "updated_at_utc": "2026-10-07T13:54:40Z",
  "principle": "Foundry owns routing, task state, manifests, report compatibility, and policy checks. Reusable deterministic import, conversion and native conformance validation belong to Rust tidas; Process preparation consumes the published owning CLI validation layers and allocation/reference evidence. Foundry does not reimplement either validator. Reusable AI context, QA, curation, remote, skill, database and API behavior remain with their owning projects.",
  "owners": [
    {
      "owner_project": "tiangong-lca-data-foundry",
      "owns": [
        "filesystem task queue",
        "capability route plans",
        "workspace manifests",
        "source package/document intake records",
        "artifact and policy checks",
        "profile-aware dataset curation package assembly",
        "gate aggregation",
        "native tidas executable/config selection and stable report/exit compatibility"
      ],
      "does_not_own": [
        "TIDAS schema definitions",
        "source package converters",
        "dataset validation engines",
        "curation queue state machine",
        "remote write semantics",
        "shared skill workflows"
      ]
    },
    {
      "owner_project": "tidas-tools",
      "owns": [
        "unified Rust tidas executable",
        "locked TIDAS schema and methodology assets",
        "external LCA package parsing and format detection",
        "TIDAS/ILCD conversion and validation",
        "stable operation reports, batch-validation protocol, exit classes, cancellation, and atomic publication"
      ]
    },
    {
      "owner_project": "tidas-sdk",
      "owns": [
        "compatibility SDK and contract/context APIs for consumers that do not execute deterministic import or validation"
      ]
    },
    {
      "owner_project": "tiangong-lca-cli",
      "owns": [
        "dataset contract/context CLI surface",
        "source authoring commands",
        "dataset curation queue build/next/verify",
        "QA, reference, publish, and verification commands"
      ]
    },
    {
      "owner_project": "tiangong-lca-skills",
      "owns": [
        "agent-facing import workflows",
        "contract-context usage instructions",
        "CLI orchestration skills"
      ]
    },
    {
      "owner_project": "tiangong-ai/skills",
      "owns": [
        "external source-evidence research skills",
        "SCI literature retrieval workflow",
        "Tiangong KB search wrappers"
      ]
    }
  ],
  "decision_rules": [
    {
      "id": "schema-or-contract",
      "route_to": "tidas-tools / tiangong-lca-cli",
      "use_when": [
        "AI needs full schema text, methodology YAML, runtime rulesets, or a stable context pack"
      ],
      "examples": ["tidas validate --describe", "dataset context-pack"]
    },
    {
      "id": "source-package-conversion",
      "route_to": "tidas-tools",
      "use_when": ["the input is a supported packaged LCA dataset"],
      "examples": ["tidas import", "node scripts/foundry.ts dataset-tidas-import"]
    },
    {
      "id": "schema-validation",
      "route_to": "tidas-tools",
      "use_when": ["candidate TIDAS documents require deterministic schema validation"],
      "examples": ["tidas validate", "node scripts/foundry.ts dataset-tidas-validate"]
    },
    {
      "id": "source-document-authoring",
      "route_to": "tiangong-lca-cli / tiangong-lca-skills",
      "use_when": ["the input is PDF, Excel, image, web export, screenshot, or free text"],
      "examples": ["dataset author", "$tidas-data-import"]
    },
    {
      "id": "external-source-evidence-skill",
      "route_to": "tiangong-ai/skills via pnpm dlx skills runtime resolution",
      "use_when": [
        "the task needs fast-moving Tiangong AI document extraction or KB research workflows such as source-document fulltext extraction or SCI literature evidence retrieval"
      ],
      "examples": [
        "pnpm dlx skills@latest use https://github.com/tiangong-ai/skills --skill document-granular-decompose --full-depth",
        "pnpm dlx skills@latest use https://github.com/tiangong-ai/skills --skill tiangong-kb-sci-search --full-depth"
      ]
    },
    {
      "id": "foundry-routing",
      "route_to": "tiangong-lca-data-foundry",
      "use_when": [
        "the change only selects capabilities, records manifests, updates task state, or checks policy"
      ],
      "examples": ["route-task", "capability registry update", "dataset-curation-gate"]
    }
  ],
  "required_follow_up_fields": [
    "missing_capability",
    "owner_project",
    "input_contract",
    "output_contract",
    "verification_gate",
    "blocking_task"
  ]
}
